{
  "doc_title": "杭州成人夜校小红书选题调研（扩展版）",
  "business_name": "杭州成人夜校",
  "city": "杭州",
  "industry": "成人兴趣班 / 夜校",
  "business_identity": "商业机构",
  "target_audience": "22-35 岁下班后想学点东西、想社交、想缓解空心感的上班族",
  "business_summary": "我们做杭州本地成人夜校，核心客户是下班后想找兴趣班、提升表达和社交体验的年轻上班族。当前核心目标不是直接铺量发内容，而是先找到在小红书上真正有效的选题方向和打法。",
  "seed_keywords": [
    "杭州夜校",
    "成人兴趣班",
    "下班后学什么"
  ],
  "report": {
    "executive_summary": [
      "杭州夜校相关内容已经形成稳定供给，玩家不只是一类：官方/公办信息发布、商业机构招生、素人体验、KOC 种草和广告笔记同时存在。",
      "真正高效的内容不一定最有创意，而是最能持续激发评论区咨询、收藏和线下决策。",
      "第一版最适合先做的不是泛鸡汤内容，而是‘适不适合我’‘怎么选’‘避坑’‘真实体验’四类方向。"
    ],
    "industry_overview": [
      "杭州本地夜校相关内容主要分为官方信息发布、商业机构招生、素人体验分享三类。",
      "高互动内容集中在课程体验、真实上课氛围、报名攻略、价格对比和避坑提醒。",
      "搜索结果中大量内容围绕城市词、区域词、课程词展开，说明同城决策和通勤便利性是关键变量。"
    ],
    "player_landscape": [
      "蓝 V / 官方号：更强在品牌信任、活动信息、报名通知，但评论活跃度未必最高。",
      "商业机构号：更擅长做课程展示、环境展示、结果展示，是最直接的转化承接方。",
      "素人号：更容易用真实体验切进用户心智，特别适合做‘我为什么去上夜校’‘下班后生活变化’这类内容。",
      "KOC / 合作号：适合放大信任和种草，常用于证明课程氛围、社交价值和真实感受。",
      "广告笔记：更常用于承接高需求词和高决策词，标题、封面和评论区钩子通常更收口。"
    ],
    "content_supply": [
      "内容供给最密集的是课程展示、环境展示、学员日常、城市夜校攻略。",
      "相对缺少真正做细分决策的内容，比如‘不同夜校模式怎么选’‘什么人不适合报夜校’。",
      "同质化最明显的是单纯晒教室、晒课程表、晒海报，但如果评论区持续有咨询，这类内容仍然有用。"
    ],
    "user_needs": [
      "用户早期更想知道夜校到底值不值得去、适不适合上班族、会不会三分钟热度。",
      "进入研究阶段后，最常见顾虑是课程种类、价格、上课距离、时间是否冲突、社交氛围怎么样。",
      "到了对比阶段，用户开始比较官方/公办、商业机构、主理人小班和不同课程方向的差异。",
      "决策前最怕踩坑：课程名看起来很吸引，但实际体验不适合自己、太远、太累、节奏跟不上。"
    ],
    "stage_personas": [
      {
        "title": "A1 认知阶段",
        "description": "典型问题是‘下班后除了回家还能干嘛’，更吃场景代入、生活变化和情绪共鸣。"
      },
      {
        "title": "A2 研究阶段",
        "description": "典型问题是‘夜校适不适合我’，需要真实体验、课程节奏、适合人群说明。"
      },
      {
        "title": "A3 对比阶段",
        "description": "典型问题是‘不同机构和不同课程怎么选’，需要清单、对比维度和判断标准。"
      },
      {
        "title": "A4 顾虑阶段",
        "description": "典型问题是‘怕踩坑、怕浪费钱、怕坚持不下来’，最吃避坑、真话、反例内容。"
      },
      {
        "title": "A5 转化前阶段",
        "description": "典型问题是‘现在报哪个班、在哪里报、价格合不合适’，需要更收口的行动信息。"
      }
    ],
    "effective_playbooks": [
      "广告内容适合打强需求词和强转化词，重点突出课程结果、氛围和报名便利性。",
      "素人 / KOC 内容更适合种草，真实体验、上课感受、社交氛围是高频有效结构。",
      "蓝 V / 官方号更适合承接信任和品牌感，但需要搭配素人内容才更容易形成完整转化路径。",
      "‘适不适合上班族’‘我为什么开始上夜校’这类内容虽然很常见，但如果评论区持续有真实咨询，就说明这类结构仍然有效。",
      "‘怎么选’和‘避坑’类内容更容易拉高收藏率，适合作为中后期转化前的重点内容。"
    ],
    "opportunity_gaps": [
      "‘什么人不适合报夜校’这类反向筛选内容少，但很容易建立信任。",
      "‘官方/公办/商业机构到底差在哪’这类高决策内容相对不足，适合做。",
      "‘下班后 2 小时生活改造’‘坚持 1 个月后的变化’这类连续体验型内容有扩展空间。",
      "针对具体课程的‘零基础值不值得学’‘学了以后能获得什么’仍有机会。"
    ],
    "topic_strategy": [
      "第一轮建议先打 A2 + A3 + A4：先建立研究信任，再承接选择，再打掉顾虑。",
      "A1 可以作为补充流量层，但不建议第一版把重心放在太泛的情绪内容上。",
      "可以接受一定程度的同质化，只要结构已被验证有效，优先复制有效表达。",
      "优先发‘真实体验’‘怎么选’‘避坑’三条示范内容，看哪一类反馈最强。"
    ],
    "action_plan": [
      "第 1 周先发 3 条示范内容，分别测试研究、对比、避坑三种方向。",
      "从评论区和私信记录真实问题，把高频问题追加进下一轮选题库。",
      "如果对比型内容收藏率高，就继续扩写不同课程、不同机构、不同预算的比较内容。",
      "如果体验型内容评论更活跃，就加大素人/KOC 表达，强化代入感和生活变化。"
    ]
  },
  "topic_rows": [
    {
      "选题": "杭州夜校到底适不适合上班族",
      "阶段": "A2",
      "核心问题": "用户想知道值不值得报名，怕坚持不下来",
      "推荐打法": "真实体验 + 上课场景 + 上班族代入",
      "推荐账号类型": "素人号 / KOC",
      "内容形式": "第一人称体验记录",
      "互动信号": "评论区常出现‘适合社恐吗/下班来得及吗’",
      "是否已验证": "已验证",
      "参考案例": "下班后去上课的一日记录型笔记",
      "优先级": "高",
      "备注": "适合作为第一轮拉新选题"
    },
    {
      "选题": "杭州夜校怎么选：官方、公办、商业机构有什么区别",
      "阶段": "A3",
      "核心问题": "用户进入选择阶段，需要判断哪种更适合自己",
      "推荐打法": "对比清单 + 维度拆解",
      "推荐账号类型": "主理人号 / 品牌号",
      "内容形式": "对比清单",
      "互动信号": "收藏率和评论咨询率通常较高",
      "是否已验证": "已验证",
      "参考案例": "不同机构课程、价格、距离、氛围的对比型内容",
      "优先级": "高",
      "备注": "适合建立专业感和决策优势"
    },
    {
      "选题": "报夜校最容易踩的 3 个坑",
      "阶段": "A4",
      "核心问题": "用户担心花钱无效、冲动报名、课程不适合",
      "推荐打法": "避坑提醒 + 具体判断标准",
      "推荐账号类型": "主理人号 / 机构号",
      "内容形式": "避坑清单",
      "互动信号": "评论区易出现真实顾虑和求建议",
      "是否已验证": "已验证",
      "参考案例": "避坑清单 + 报名前自查项",
      "优先级": "高",
      "备注": "适合提升咨询质量"
    },
    {
      "选题": "杭州有哪些适合女生下班后去的夜校课程",
      "阶段": "A2",
      "核心问题": "用户想找轻松、治愈、能坚持的课程方向",
      "推荐打法": "课程盘点 + 场景代入",
      "推荐账号类型": "素人号 / 机构号",
      "内容形式": "清单推荐",
      "互动信号": "点赞和收藏通常高于纯品牌介绍",
      "是否已验证": "待验证",
      "参考案例": "城市兴趣班合集类内容",
      "优先级": "高",
      "备注": "适合做流量入口"
    },
    {
      "选题": "下班后报夜校的人，后来都怎么样了",
      "阶段": "A2",
      "核心问题": "用户想知道长期体验和真实变化",
      "推荐打法": "变化故事 + 情绪共鸣",
      "推荐账号类型": "素人号 / KOC",
      "内容形式": "阶段变化记录",
      "互动信号": "更容易触发转发和长评论",
      "是否已验证": "待验证",
      "参考案例": "一个月体验变化复盘型内容",
      "优先级": "高",
      "备注": "适合做品牌好感和代入"
    },
    {
      "选题": "零基础报表达课 / 绘画课 / 摄影课，到底哪个更适合上班族",
      "阶段": "A3",
      "核心问题": "用户不知道先学什么，怕选错",
      "推荐打法": "课程对比 + 人群匹配",
      "推荐账号类型": "主理人号 / 老师号",
      "内容形式": "对比建议",
      "互动信号": "评论会出现个体偏好问题",
      "是否已验证": "待验证",
      "参考案例": "不同课程适合人群拆解",
      "优先级": "高",
      "备注": "适合拆分成系列"
    },
    {
      "选题": "如果你总是下班回家就躺平，夜校可能是最轻的一种改变",
      "阶段": "A1",
      "核心问题": "用户还没意识到夜校是个选项",
      "推荐打法": "场景共鸣 + 轻启发",
      "推荐账号类型": "素人号",
      "内容形式": "共鸣短文",
      "互动信号": "点赞容易高，但咨询未必高",
      "是否已验证": "待验证",
      "参考案例": "下班后生活方式内容",
      "优先级": "中",
      "备注": "适合作为流量铺垫"
    },
    {
      "选题": "杭州夜校课程价格为什么差这么多",
      "阶段": "A3",
      "核心问题": "用户在比较预算和价值",
      "推荐打法": "价格拆解 + 决策维度",
      "推荐账号类型": "机构号 / 主理人号",
      "内容形式": "价格解释",
      "互动信号": "收藏高，评论多问具体班型",
      "是否已验证": "已验证",
      "参考案例": "价格区间和服务差异拆解",
      "优先级": "高",
      "备注": "适合承接转化前流量"
    },
    {
      "选题": "报夜校前先问自己这 4 个问题",
      "阶段": "A4",
      "核心问题": "用户怕冲动报名后后悔",
      "推荐打法": "反向筛选 + 真话表达",
      "推荐账号类型": "主理人号",
      "内容形式": "自测清单",
      "互动信号": "更容易建立信任感",
      "是否已验证": "待验证",
      "参考案例": "不适合人群筛选类内容",
      "优先级": "高",
      "备注": "有助于提升成交质量"
    },
    {
      "选题": "什么样的人其实不适合报夜校",
      "阶段": "A4",
      "核心问题": "用户想提前确认自己会不会踩坑",
      "推荐打法": "反向内容 + 建立信任",
      "推荐账号类型": "主理人号 / 老师号",
      "内容形式": "反向筛选",
      "互动信号": "评论质量高，容易带来真实咨询",
      "是否已验证": "待验证",
      "参考案例": "不适合购买的人群说明",
      "优先级": "高",
      "备注": "虽然不常见，但很值得测试"
    },
    {
      "选题": "杭州夜校真实上课氛围长什么样",
      "阶段": "A2",
      "核心问题": "用户担心尴尬、担心氛围不适合自己",
      "推荐打法": "空间展示 + 真实片段",
      "推荐账号类型": "机构号 / KOC",
      "内容形式": "上课实拍",
      "互动信号": "完播和收藏相对更高",
      "是否已验证": "已验证",
      "参考案例": "教室、学员互动、课后交流展示",
      "优先级": "高",
      "备注": "适合配合素人体验内容"
    },
    {
      "选题": "杭州夜校报名攻略：新手第一次怎么选不容易后悔",
      "阶段": "A5",
      "核心问题": "用户接近报名，想要更直接的行动建议",
      "推荐打法": "行动清单 + 报名前须知",
      "推荐账号类型": "机构号 / 官方号",
      "内容形式": "报名攻略",
      "互动信号": "评论会问具体时间和地址",
      "是否已验证": "已验证",
      "参考案例": "报名流程说明型内容",
      "优先级": "高",
      "备注": "适合作为承接内容"
    },
    {
      "选题": "预算不高的人，报夜校应该优先看什么",
      "阶段": "A3",
      "核心问题": "用户预算有限，想避免低效消费",
      "推荐打法": "预算维度 + 价值判断",
      "推荐账号类型": "主理人号 / 机构号",
      "内容形式": "预算建议",
      "互动信号": "收藏率高于点赞率",
      "是否已验证": "待验证",
      "参考案例": "低预算优先级选择内容",
      "优先级": "中",
      "备注": "适合吸引价格敏感用户"
    },
    {
      "选题": "夜校不只是上课，很多人真正买单的是这个",
      "阶段": "A2",
      "核心问题": "用户不只关心技能，也关心情绪价值和社交价值",
      "推荐打法": "价值重构 + 真实感受",
      "推荐账号类型": "素人号 / KOC",
      "内容形式": "认知转化",
      "互动信号": "容易引发共鸣型评论",
      "是否已验证": "待验证",
      "参考案例": "社交和情绪价值表达",
      "优先级": "中",
      "备注": "适合做差异化卖点内容"
    },
    {
      "选题": "为什么很多人报了夜校却坚持不下来",
      "阶段": "A4",
      "核心问题": "用户担心自己成为半途而废的人",
      "推荐打法": "失败原因拆解 + 解决建议",
      "推荐账号类型": "主理人号 / 素人号",
      "内容形式": "失败复盘",
      "互动信号": "评论区会出现真实共鸣和补充",
      "是否已验证": "待验证",
      "参考案例": "常见失败原因总结",
      "优先级": "中",
      "备注": "适合提高内容深度"
    }
  ],
  "demo_notes": [
    {
      "title": "杭州夜校适合上班族吗？我上了 3 次后说点真话",
      "stage": "A2",
      "angle": "研究 / 建立信任",
      "body": "如果你也总觉得下班回家刷手机很空，但又怕报班坚持不下来，那杭州夜校这件事你可以先这样理解：它不是让你立刻逆天改命，而是给你一个固定走出去、学点东西、认识同频人的理由。\n\n我最近连续体验了几次，最明显的感受不是学到了多少，而是下班后的状态真的不一样了。以前一下班就容易瘫掉，现在至少一周里会有两天是带着期待出门的。\n\n如果你是第一次看夜校，我建议先不要急着冲最热门课程，先看三件事：离你公司或住处远不远、课程是不是你真感兴趣、同学氛围是不是你能坚持下去的。\n\n很多人不是败在课程不行，而是败在通勤太累、节奏不适合自己。",
      "tags": ["杭州夜校", "成人兴趣班", "上班族下班后"]
    },
    {
      "title": "杭州夜校怎么选？我把 3 种常见模式讲清楚了",
      "stage": "A3",
      "angle": "对比 / 选择",
      "body": "最近很多人问我，杭州夜校到底怎么选，为什么有的很难抢，有的看起来课程差不多但价格差很多。\n\n你可以先把常见选择分成三类：官方/公办、商业机构、主理人小班。\n\n如果你最在意的是价格和稳定感，优先看官方或公办；如果你更看重课程体验、服务和氛围，商业机构通常会更完整；如果你想要更强的陪伴感和社群感，小班型主理人课程更适合。\n\n真正决定你会不会坚持下去的，往往不是哪家最火，而是它和你的通勤、预算、社交偏好是否匹配。",
      "tags": ["杭州夜校怎么选", "兴趣班推荐", "夜校对比"]
    },
    {
      "title": "报夜校前一定先看：最容易踩的 3 个坑",
      "stage": "A4",
      "angle": "顾虑 / 避坑",
      "body": "如果你已经准备报名夜校，我真心建议你先避开这 3 个坑。\n\n第一，不要只看课程名好不好听。很多人报名前只看摄影、表达、咖啡这些名字，结果上了两次发现根本不是自己预期的内容。\n\n第二，不要忽略通勤。下班后 30 分钟和 60 分钟，对坚持率完全不是一回事。\n\n第三，不要冲动报最热班。热门不一定适合你，尤其是零基础用户，更需要看课程节奏和老师的带班方式。\n\n报名之前，先问清楚课程安排、适合什么基础、上课地点和班级氛围，很多后悔都是因为这些问题没提前确认。",
      "tags": ["夜校避坑", "杭州夜校报名", "兴趣班避坑"]
    }
  ]
}
